{
  "manifest_version": "1.0.0",
  "model_id": "person_detection_mediapipe_v1",
  "model_name": "MediaPipe Person Detector (OpenCV Zoo)",
  "task": "person_detection",
  "version": "2023mar",
  "upstream": {
    "repository": "https://github.com/opencv/opencv_zoo",
    "commit": "8e2b658d1007864a24cc2cf0e5b4288c74b32584",
    "path": "models/person_detection_mediapipe/person_detection_mediapipe_2023mar.onnx",
    "license": "Apache-2.0",
    "license_url": "https://raw.githubusercontent.com/opencv/opencv_zoo/main/models/person_detection_mediapipe/LICENSE"
  },
  "artifact": {
    "filename": "person_detection_mediapipe_2023mar.onnx",
    "format": "onnx",
    "sha256": "47fd5599d6fa17608f03e0eb0ae230baa6e597d7e8a2c8199fe00abea55a701f",
    "size_bytes": 1199015,
    "download_urls": [
      "https://raw.githubusercontent.com/opencv/opencv_zoo/8e2b658d1007864a24cc2cf0e5b4288c74b32584/models/person_detection_mediapipe/person_detection_mediapipe_2023mar.onnx",
      "https://github.com/opencv/opencv_zoo/raw/main/models/person_detection_mediapipe/person_detection_mediapipe_2023mar.onnx",
      "https://huggingface.co/opencv/opencv_zoo/resolve/main/models/person_detection_mediapipe/person_detection_mediapipe_2023mar.onnx"
    ]
  },
  "preprocessing": {
    "color_format": "RGB",
    "input_shape": [1, 3, 224, 224],
    "data_type": "float32",
    "normalization": "scale_to_minus_one_to_one",
    "aspect_ratio_mode": "letterbox_center_pad"
  },
  "postprocessing": {
    "confidence_threshold": 0.5,
    "nms_threshold": 0.3,
    "top_k": 5000
  },
  "runtime_compatibility": {
    "engine": "opencv_dnn",
    "preferred_backend": "DNN_BACKEND_OPENCV",
    "preferred_target": "DNN_TARGET_CPU",
    "supported_targets": [
      "cpu",
      "cuda",
      "timvx",
      "cann"
    ]
  }
}
