{
  "manifest_version": "1.0.0",
  "model_id": "pose_estimation_mediapipe_v1",
  "model_name": "MediaPipe Pose Estimation (OpenCV Zoo)",
  "task": "pose_estimation",
  "version": "2023mar",
  "upstream": {
    "repository": "https://github.com/opencv/opencv_zoo",
    "commit": "1f19f821d68288feff2ef5c53993b33da74b1509",
    "path": "models/pose_estimation_mediapipe/pose_estimation_mediapipe_2023mar.onnx",
    "license": "Apache-2.0",
    "license_url": "https://raw.githubusercontent.com/opencv/opencv_zoo/main/models/pose_estimation_mediapipe/LICENSE"
  },
  "artifact": {
    "filename": "pose_estimation_mediapipe_2023mar.onnx",
    "format": "onnx",
    "sha256": "9d89c599319a18fb7d2e28451a883476164543182bafca5f09eb2cf767ed2f3f",
    "size_bytes": 5557238,
    "download_urls": [
      "https://raw.githubusercontent.com/opencv/opencv_zoo/1f19f821d68288feff2ef5c53993b33da74b1509/models/pose_estimation_mediapipe/pose_estimation_mediapipe_2023mar.onnx",
      "https://github.com/opencv/opencv_zoo/raw/main/models/pose_estimation_mediapipe/pose_estimation_mediapipe_2023mar.onnx",
      "https://huggingface.co/opencv/opencv_zoo/resolve/main/models/pose_estimation_mediapipe/pose_estimation_mediapipe_2023mar.onnx"
    ]
  },
  "preprocessing": {
    "color_format": "RGB",
    "input_shape": [1, 3, 256, 256],
    "data_type": "float32",
    "normalization": "scale_to_zero_to_one",
    "box_enlarge_factor": 1.25,
    "box_pre_enlarge_factor": 1.0
  },
  "postprocessing": {
    "confidence_threshold": 0.5,
    "landmark_count": 33,
    "landmark_channels": [
      "x",
      "y",
      "z",
      "visibility",
      "presence"
    ],
    "has_segmentation_mask": true,
    "has_heatmap": true
  },
  "runtime_compatibility": {
    "engine": "opencv_dnn",
    "preferred_backend": "DNN_BACKEND_OPENCV",
    "preferred_target": "DNN_TARGET_CPU",
    "supported_targets": [
      "cpu",
      "cuda",
      "timvx",
      "cann"
    ]
  }
}
